<?xml version="1.0" encoding="UTF-8"?>
<mhg xmlns:xsi="http://www.w3.org/2001/XMLSchema-instance" xsi:noNamespaceSchemaLocation="example.xsd">
  <melding>
    <p.informatieverzoek>true</p.informatieverzoek>
  </melding>
  <zaak>
    <p.instelling>p.instelling</p.instelling>
    <p.code_zaak>p.code_zaak</p.code_zaak>
    <p.persoon_bekend>
      <p.persoon_bekend>
        <p.instelling>p.instelling</p.instelling>
        <p.bekend>true</p.bekend>
        <p.huiselijk_geweld>true</p.huiselijk_geweld>
        <p.code_contactpersoon>p.code_contactpersoon</p.code_contactpersoon>
        <p.code_persoon>p.code_persoon</p.code_persoon>
      </p.persoon_bekend>
    </p.persoon_bekend>
    <p.omschrijving>p.omschrijving</p.omschrijving>
    <p.datum_eerste_melding>2001-01-01</p.datum_eerste_melding>
    <p.datum_start_hulp>2001-01-01</p.datum_start_hulp>
  </zaak>
  <contactpersoon>
    <p.code_contactpersoon>p.code_contactpersoon</p.code_contactpersoon>
    <p.instelling>p.instelling</p.instelling>
    <p.persoonsnaam>
      <p.achternaam>p.achternaam</p.achternaam>
    </p.persoonsnaam>
    <p.geslacht>p.geslacht</p.geslacht>
  </contactpersoon>
  <betrokkenen>
    <p.persoonsnaam>
      <p.voorletters>p.voorletters</p.voorletters>
      <p.achternaam>p.achternaam</p.achternaam>
    </p.persoonsnaam>
    <p.voornamen>p.voornamen</p.voornamen>
    <p.geslacht>p.geslacht</p.geslacht>
    <p.adres>
      <p.adres>
        <p.straatnaam>p.straatnaam</p.straatnaam>
        <p.huisnummer>0</p.huisnummer>
        <p.postcode>p.postcode</p.postcode>
        <p.plaatsnaam>p.plaatsnaam</p.plaatsnaam>
      </p.adres>
    </p.adres>
    <p.code_persoon>p.code_persoon</p.code_persoon>
    <p.laatste_persoon>true</p.laatste_persoon>
  </betrokkenen>
</mhg>
